author,title
John Paparrizos (University of Chicago)*; Paul Boniol (Université de Paris); Themis Palpanas (University of Paris); Ruey Tsay (University of Chicago); Aaron J Elmore (University of Chicago); Michael Franklin (University of Chicago),Volume Under the Surface: A New Accuracy Evaluation Measure for Time-Series Anomaly Detection
Haoteng YIN (Purdue University)*; Muhan Zhang (Peking University); Yanbang Wang (Cornell University); Jianguo Wang (Purdue University); Pan Li (Purdue University),Algorithm and System Co-design for Efficient Subgraph-based Graph Representation Learning
Michael Freitag (TUM)*; Alfons Kemper (TUM); Thomas Neumann (TUM),Memory-Optimized Multi-Version Concurrency Control for Disk-Based Database Systems
"Dong He (University of Washington)*; Supun C Nakandala (University of California, San Diego); Dalitso Banda (Microsoft); Rathijit Sen (Microsoft); Karla Saur (Microsoft); Kwanghyun Park (Microsoft); Carlo Curino (Microsoft -- GSL); Jesús Camacho-Rodríguez (Microsoft); Konstantinos Karanasos (Meta); Matteo Interlandi (Microsoft)",Query Processing on Tensor Computation Runtimes
Yifu Tang (Deakin University ); Jianxin Li (Deakin University)*; Nur Al Hasan Haldar (The University of Western Australia); Ziyu Guan (Xidian University); Jiajie Xu (Soochow University); Chengfei Liu (Swinburne University of Technology),Reliable Community Search in Dynamic Networks
"Mohammad Javad Amiri  (University of Pennsylvania)*; Boon Thau Loo (Univ. of Pennsylvania); Divy Agrawal (University of California, Santa Barbara); Amr El Abbadi (UC Santa Barbara)",Qanaat: A Scalable Multi-Enterprise Permissioned Blockchain System with Confidentiality Guarantees
Tsz Nam Chan (Hong Kong Baptist University)*; Leong Hou U (University of Macau); Yun PENG (Hong Kong Baptist University); Byron Choi (Hong Kong Baptist University); Jianliang Xu (Hong Kong Baptist University),Fast Network K-function-based Spatial Analysis
"Robert Lasch (TU Ilmenau, SAP SE)*; Thomas Legler (SAP SE); Norman May (SAP SE); Bernhard Scheirle (SAP SE); Kai-Uwe Sattler (TU Ilmenau)",Cost Modelling for Optimal Data Placement in Heterogeneous Main Memory
Junru Li (Tsinghua University)*; Youyou Lu (luyouyou@tsinghua.edu.cn); Yiming Zhang (Xiamen University); Qing Wang (Tsinghua University); Zhuo Cheng (Huawei Storage Product Line); Keji Huang (Huawei); Jiwu Shu (shujw@tsinghua.edu.cn),SwitchTx: Scalable In-Network Coordination for Distributed Transaction Processing
Lukas Vogel (TUM)*; Alexander van Renen (Friedrich-Alexander-Universität Erlangen-Nürnberg ); Satoshi Imamura (Fujitsu Laboratories Ltd.); Jana Giceva (TU Munich); Thomas Neumann (TUM); Alfons Kemper (TUM),Plush: A Write-Optimized Persistent Log-Structured Hash-Table
Fangyuan ZHANG (The Chinese Univesity of Hong Kong); Sibo Wang (The Chinese University of Hong Kong)*,Effective Indexing for Dynamic Structural Graph Clustering
Immanuel Trummer (Cornell)*,CodexDB: Synthesizing Code for Query Processing from Natural Language Instructions using GPT-3 Codex
Arnab Phani (Graz University of Technology)*; Lukas Erlbacher (Graz University of Technology); Matthias Boehm (Graz University of Technology),UPLIFT: Parallelization Strategies for Feature Transformations in Machine Learning Workloads
Xinjing Zhou (Massachusetts Institute of Technology)*; Xiangyao Yu (University of Wisconsin-Madison); Goetz Graefe (Google); Michael Stonebraker (MIT),Lotus: Scalable Multi-Partition Transactions on Single-Threaded Partitioned Databases
"Konstantinos Kanellis (University of Wisconsin-Madison)*; Cong Ding (University of Wisconsin-Madison); Brian Kroth (Microsoft); Andreas C Mueller (Microsoft); Carlo Curino (Microsoft); Shivaram Venkataraman (University of Wisconsin, Madison)",LlamaTune: Sample-Efficient DBMS Configuration Tuning
Christian Winter (TUM)*; Jana Giceva (TU Munich); Thomas Neumann (TUM); Alfons Kemper (TUM),On-Demand State Separation for Cloud Data Warehousing
Immanuel Trummer (Cornell)*,BABOONS: Black-Box Optimization of Data Summaries in Natural Language
Xiaoying Wang (Simon Fraser University); Weiyuan Wu (Simon Fraser University); Jinze Wu (Simon Fraser University); Yizhou Chen (Simon Fraser University); Nick Zrymiak (Simon Fraser University); Changbo Qu (Simon Fraser University); Lampros Flokas (Columbia University); George Chow (Simon Fraser University); Jiannan Wang (Simon Fraser University)*; Tianzheng Wang (Simon Fraser University); Eugene Wu (Columbia University); Qingqing Zhou (Tencent Inc.),ConnectorX: Accelerating Data Loading From Databases to Dataframes
Chaichon Wongkham (The Chinese University of Hong Kong)*; Baotong Lu (Chinese University of Hong Kong); Chris Liu (Chinese University of Hong Kong); Zhicong Zhong (Chinese University of Hong Kong); Eric Lo (Chinese University of Hong Kong); Tianzheng Wang (Simon Fraser University),Are Updatable Learned Indexes Ready?
Maximilian Reif (Technical University of Munich)*; Thomas Neumann (TUM),A Scalable and Generic Approach to Range Joins
Ellen Hohma (Technical University of Munich); Christian M.M. Frey (Christian-Albrechts-University Kiel); Anna Beer (LMU Munich)*; Thomas Seidl (LMU Munich),SCAR - Spectral Clustering Accelerated and Robustified
Michael Benedikt (Oxford University)*; Maxime Buron (Oxford University); Stefano Germano (University of Oxford); Kevin Kappelmann (TU Munich); Boris Motik (University of Oxford),Rewriting the Infinite Chase
Panagiotis Liakos (University of Athens)*; Katia Papakonstantinopoulou (Athens University of Economics and Business); Yannis Kotidis (Athens University of Economics and Business),Chimp: Efficient Lossless Floating Point Compression for Time Series Databases
Niv Dayan (Pliops)*; Tamar Weiss (Pliops); Shmuel Dashevsky (Pliops); Michael Pan (Pliops); Edward Bortnikov (Pliops); Moshe Twitto (Pliops),Spooky: Granulating LSM-Tree Compactions Correctly
Kai Yao (The University of Sydney)*; Lijun Chang (The University of Sydney); Jeffrey Xu Yu (Chinese University of Hong Kong),Identifying Similar-Bicliques in Bipartite Graphs
Chenghao Lyu (University of Massachusetts Amherst)*; Qi Fan (Ecole Polytechnique); Fei Song (Ecole Polytechnique); Arnab Sinha (Ecole Polytechnique); Yanlei Diao (Ecole Polytechnique); Wei Chen (Alibaba); Li  Ma (Alibaba Group); Yihui Feng (Alibaba Group); Yaliang Li (Alibaba Group); Kai  Zeng (Alibaba Group); Jingren Zhou (Alibaba Group),Fine-Grained Modeling and Optimization for Intelligent Resource Management in Big Data Processing
Ziyi Liu (The University of Queensland)*; Lei Li (The Hong Kong University of Science and Technology (Guang Zhou)); Mengxuan Zhang (Iowa State University); Wen Hua (The University of Queensland); Xiaofang Zhou (The Hong Kong University of Science and Technology),FHL-Cube: Multi-Constraint Shortest Path Querying with Flexible Combination of Constraints
Michael Abebe (University of Waterloo)*; Horatiu Lazu (University of Waterloo); Khuzaima Daudjee (University of Waterloo),Tiresias: Enabling Predictive Autonomous Storage and Indexing
Abolfazl Asudeh (University of Illinois at Chicago)*; Fatemeh Nargesian (University of Rochester),Towards Distribution-aware Query Answering in Data Markets
Suyong Kwon (Seoul National University); Woohwan Jung (Hanyang University)*; Kyuseok Shim (Seoul National University),Cardinality Estimation of Approximate Substring Queries using Deep Learning
"Karla Saur (Microsoft)*; Tara Mirmira (University of California, San Diego); Konstantinos Karanasos (Meta); Jesús Camacho-Rodríguez (Microsoft)",Containerized Execution of UDFs: An Experimental Evaluation
Steven Xia (University of Chicago)*; Zhiru Zhu (University of Chicago); Christopher Zhu (The University of Chicago); Jinjin Zhao (University of Chicago); Kyle Chard (Computation Institute); Aaron J Elmore (University of Chicago); Ian Foster (University of Chicago &amp; Argonne Nat Lab); Michael Franklin (University of Chicago); Sanjay Krishnan (U Chicago); Raul Castro Fernandez (UChicago),"Data Station: Delegated, Trustworthy, and Auditable Computation to Enable Data-Sharing Consortia with a Data Escrow"
"Khaled Ammar (University of Waterloo, Thomson Reuters Labs)*; Siddhartha Sahu (University of Waterloo); Semih Salihoglu (University of Waterloo); Tamer Özsu (University of Waterloo)",Optimizing Differentially-Maintained Recursive Queries on Dynamic Graphs
Zihan Luo (The Hong Kong University of Science and Technology (Guang Zhou))*; Lei Li (The Hong Kong University of Science and Technology (Guang Zhou)); Mengxuan Zhang (Iowa State University); Wen Hua (The University of Queensland); Yehong Xu (Hongkong university of science and technology); Xiaofang Zhou (The Hong Kong University of Science and Technology),Diversified Top-k Route Planning in Road Network
Xiangmin Zhou (RMIT University)*; Lei  Chen (Hong Kong University of Science and Technology),Migrating Social Event Recommendation Over Microblogs
Yueting Chen (York University ); Nick Koudas (University of Toronto); Xiaohui Yu (York University)*; Ziqiang Yu (Yantai University),Spatial and Temporal Constrained Ranked Retrieval over Videos
Ningyi Liao (Nanyang Technological University )*; Dingheng Mo (Nanyang Technological University); Siqiang Luo (Nanyang Technological University); Xiang Li (East China Normal University); Pengcheng Yin (Carnegie Mellon University),SCARA: Scalable Graph Neural Networks with Feature-Oriented Optimization
Antonis Manousis (Carnegie Mellon University)*; zhuo cheng (Peking University); Zaoxing Liu (Boston University); Ran Ben Basat (UCL); Vyas Sekar (Carnegie Mellon University),Enabling Efficient and General Subpopulation Analytics in Multidimensional Data Streams
"Qing Chen (University of Zürich)*; Oded Lachish (Birkbeck, University of London); Sven Helmer (University of Zurich); Michael H Böhlen (University of Zurich)",Dynamic Spanning Trees for Connectivity Queries on Fully-dynamic Undirected Graphs
Monica Chiosa (ETH Zurich)*; Fabio Maschi (ETHZ); Ingo Müller (Google); Gustavo Alonso (ETHZ); Norman May (SAP SE),Hardware Acceleration of Compression and Encryption in SAP HANA
Martin Graf (Hasso Plattner Institute); Lukas Laskowski (Hasso Plattner Institute); Florian Papsdorf (Hasso Plattner Institute); Florian Sold (Hasso Plattner Institute); Roland Gremmelspacher (SAP SE); Felix Naumann (Hasso Plattner Institute); Fabian Panse (Universität Hamburg)*,Frost: A Platform for Benchmarking and Exploring Data Matching Results
Changji Li (CUHK)*; Hongzhi CHEN (ByteDance); Shuai Zhang (Bytedance); Yingqian HU (ByteDance); Chao Chen (ByteDance); Zhenjie ZHANG (ByteDance); Meng LI (ByteDance); Xiangchen Li (ByteDance); Dongqing Han (ByteDance); Xiaohui Chen (Bytedance Ltd); Xudong Wang (bytedance); Huiming Zhu (ByteDance); Xuwei FU (bytedance); Tingwei Wu (ByteDance); Hongfei Tan (ByteDance); Hengtian Ding (ByteDance); Mengjin Liu (ByteDance); Kangcheng WANG (ByteDance); Ting Ye (ByteDance); Lei LI (ByteDance); Xin Li (ByteDance); Yu Wang (ByteDance); Chenguang Zheng (CUHK); Hao Yang (Bytedance.com); James Cheng (CUHK),ByteGraph: A High-Performance Distributed Graph Database in ByteDance
"Prakash C Das (Informatica); Shivangi srivastava (Informatica); Valentin Moskovich (Informatica)*; Anmol Chaturvedi (Informatica); Anant Mittal (Informatica); Yongqin Xiao (Informatica); Mosharaf Chowdhury (University of Michigan, Ann Arbor)",CDI-E: An Elastic Cloud Service for Data Engineering
Sheng Wang (Alibaba Group)*; Yiran Li (Alibaba Group); Huorong Li (Alibaba Group); Feifei Li (Alibaba Group); Chengjin Tian (Alibaba Group); Le Su (Alibaba Group); yanshan Zhang (Alibaba Group); Yubing Ma (Alibaba Group); Lie Yan (Alibaba Group); Yuanyuan Sun (Alibaba Group); Xuntao Cheng (Alibaba Group); Xiaolong Xie (Alibaba Group); Yu Zou (Alibaba Group),Operon: An Encrypted Database for Ownership-Preserving Data Management
caixin gong (Alibaba Group)*; Chengjin Tian (Alibaba Group); Zhengheng Wang (Alibaba Group); Sheng Wang (Alibaba Group); Xiyu Wang (Alibaba Group); Qiulei Fu (Alibaba Group); Wu Qin (Alibaba); qian long (alibaba); Rui Chen (Alibaba); Jiang Qi (Alibaba); Ruo Wang (Alibaba); Guoyun Zhu (Alibaba Group); Chenghu Yang (Alibaba Group); Wei Zhang (Alibaba Inc.); Feifei Li (Alibaba Group),Tair-PMem: a Fully Durable Non-Volatile Memory Database
Branimir Lambov (DataStax)*,Trie memtables in Cassandra
"Pedro Pedreira (Facebook Inc.)*; Orri Erling (Facebook); Maria Basmanova (Facebook); Kevin Wilfong (Facebook); Laith s Sakka (Meta); Krishna Pai (Meta); Wei He (Meta Platforms, Inc.); Biswapesh Chattopadhyay (Facebook)",Velox: Meta’s Unified Execution Engine
Zhenkun YANG (OceanBase); Chuanhui Yang (OceanBase); Fusheng Han (OceanBase); MingQiang Zhuang (OceanBase); Bing Yang (OceanBase); Zhifeng Yang (OceanBase); cheng xiaojun (oceanbase); Yuzhong Zhao (oceanbase); Wenhui Shi (OceanBase); huafeng xi (oceanbase.com); Huang Yu (Ant Financial Group); LIU BIN (OceanBase); Yi Pan (OceanBase); BOXUE YIN (OceanBase); Junquan Chen (OceanBase); Quanqing Xu (OceanBase)*,OceanBase: A 707 Million tpmC Distributed Relational Database System
Hai Lan (RMIT University); Jiong Xie (Alibaba Group); Zhifeng  Bao (RMIT University)*; Feifei Li (Alibaba Group); Wei Tian (Alibaba Group); Eric Wong (Alibaba); Sheng Wang (Alibaba Group); Ailin Zhang (Alibaba),"VRE: A Versatile, Robust, and Economical Trajectory Data System"
Jianjun Chen (Bytedance)*; Yonghua Ding (Bytedance.com); Ye Liu (Bytedance Inc.); Fangshi Li (Bytedance); Li Zhang (ByteDance); Mingyi Zhang (ByteDance Inc); Kui Wei (ByteDance Inc.); Cao Lixun (ByteDance); Dan Zou (ByteDance); Yang Liu (ByteDance); Lei Zhang (ByteDance); Rui Shi (ByteDance Inc.); Wei Ding (Bytedance); KAI WU (ByteDance); Shangyu Luo (ByteDance); Jason Sun (Bytedance ); Yuming Liang (ByteDance Inc.),ByteHTAP: ByteDance’s HTAP System with High Data Freshness and Strong Data Consistency
Wolfram Wingerath (University of Oldenburg)*; Benjamin Wollmer (University of Hamburg); Markus Bestehorn (Amazon Web Services); Stephan Succo (Baqend); Sophie Ferrlein (Baqend); Florian Bücklers (Baqend); Jörn Domnik (Baqend); Fabian Panse (Universität Hamburg); Erik Witt (Baqend); Anil Sener (Amazon Web Services); Felix Gessert (Universität Hamburg); Norbert Ritter (Universität Hamburg),Beaconnect: Continuous Web Performance A/B Testing at Scale
Zongzhi Chen (Alibaba Group)*; xinjun Yang (Alibaba Group); Feifei Li (Alibaba Group); Xuntao Cheng (Alibaba Group); Qingda Hu (Alibaba Group); Zheyu Miao (Alibaba Group); Rongbiao Xie (Alibaba group); Xiaofei Wu (Alibaba Group); Kang Wang (Alibaba Group); Zhao Song (Alibaba Group); Haiqing Sun (Alibaba Group); Zechao Zhuang (Alibaba Group); Yuming Yang (Alibaba Group); Jie Xu (Alibaba Group); Liang Yin (Alibaba Group); Wenchao Zhou (Alibaba Group); Sheng Wang (Alibaba Group),CloudJump: Optimizing Cloud Databases for Cloud Storages
Kaiping Zheng (National University of Singapore); Shaofeng Cai (National University of Singapore); Horng-Ruey Chua (National University Hospital); Melanie Herschel (Universität Stuttgart); Meihui Zhang (Beijing Institute of Technology); Beng Chin Ooi (NUS)*,DyHealth: Making Neural Networks Dynamic for Effective Healthcare Analytics
Andrey Mishchenko (University Of Michigan); Dominique Danco (University of Amsterdam); Abhilash Jindal (IIT Delhi)*; Adrian Blue (Instabase),Blueprint: a constraint-solving approach for document extraction
"Muzhi Yu (Peking University)*; Zhaoxiang Lin (tencent); Jinan Sun (Peking University); ZHOU RUNYUN (Tencent Cloud Computing (Beijing) Co., Ltd.); Jiang Guoqiang (tencent); hua huang (tencent); Shikun Zhang (Peking University)",TencentCLS: The Cloud Log Service with High Query Performances
Jiong Xie (Alibaba Group); Zhen chenz (Alibaba Corp.); jianwei liu (alibaba); Eric Wong (Alibaba); Feifei Li (Alibaba Group); Zhida Chen (Alibaba Group)*; Yinpei Liu (Alibaba Group); Songlu Cai (Alibaba Group); zhenhua fan (Alibaba-inc); Fei Xiao (Alibaba Group); Yue Chen (Alibaba group),"Ganos: A Multidimensional, Dynamic, and Scene-Oriented Cloud-Native Spatial Database Engine"
Sarath Lakshman (Couchbase)*; Apaar Gupta (Couchbase Inc.); Rohan Suri (Couchbase); Scott D Lashley (Couchbase); John Liang (Couchbase Inc); Srinath Duvuru (Couchbase),Magma: A high data density storage engine used in Couchbase
Joyce Cahoon (Microsoft); Wenjing Wang (microsoft); Yiwen Zhu (Microsoft)*; Katherine Lin (Microsoft); Sean Liu (Microsoft); Raymond Truong (Microsoft); Neetu Singh (Microsoft); Chengcheng Wan (University of Chicago); Alexandra M Ciortea (Microsoft); Sreraman Narasimhan (Microsoft); Subru Krishnan (Microsoft),Doppler: Automated SKU Recommendation in Migrating SQL Workloads to the Cloud
Stavros Harizopoulos (Meta)*; Taylor Hopper (Meta); Morton Mo (Meta); Shyam Sundar Chandrasekaran (Meta); Tongguang Chen (Meta); Yan Cui (Meta); Nandini Ganesh (Meta); Gary Helmling (Meta); Hieu Pham (Meta); Sebastian Wong (Meta),Meta's Next-generation Realtime Monitoring and Analytics Platform
Kevin P Gaffney (University of Wisconsin-Madison)*; Martin Prammer (University of Wisconsin - Madison); Laurence C Brasfield (SQLite devs); Richard Hipp (SQLite.org); Dan R Kennedy (Sqlite); Jignesh Patel (UW - Madison),"SQLite: Past, Present, and Future"
Rentong Guo (Zilliz); Long Xiang (Southern University of Science and Technology); Xiaofan Luan (ZilliZ); Xiao Yan (Southern University of Science and Technology)*; Xiaomeng Yi (Zilliz); Jigao Luo (Zilliz); qianya cheng (zilliz); Weizhi Xu (Zilliz); Jiarui Luo (Southern University of Science and Technology); Frank Liu (Zilliz); Zhenshan Cao (Zilliz); yanliang qiao (Zilliz); Ting Wang (zilliz); Bo Tang  (Southern University of Science and Technology); Charles Xie (Zilliz),Manu: A Cloud Native Vector Database Management System
Sainyam Galhotra (University of Chicago)*; Udayan Khurana (IBM Research),Automated Relational Data Explanation using External Semantic Knowledge
Andrea Rossi (Roma Tre University)*; Donatella Firmani (Sapienza University); Paolo Merialdo (University Roma Tre); Tommaso Teofili (Roma Tre University),Kelpie: an Explainability Framework for Embedding-based Link Prediction Models
Yin Lin (University of Michigan)*; Brit Youngmann (MIT); Yuval Moskovitch (University of Michigan); H. V. Jagadish (University of Michigan); Tova Milo (Tel Aviv University),OREO: Detection of Cherry-picked Generalizations
André Kohn (Technical University of Munich)*; Dominik Moritz (Carnegie Mellon University); Mark Raasveldt (CWI); Hannes Mühleisen (Centrum Wiskunde &amp; Informatica); Thomas Neumann (TU Munich),DuckDB-Wasm: Fast Analytical Processing for the Web
"Yihai Xi (School of Computer and Information Technology, Beijing Jiaotong University); Ning Wang (School of Computer and Information Technology, Beijing Jiaotong University)*; Xinyu Chen (School of Computer and Information Technology, Beijing Jiaotong University); Yiyi Zhang (School of Computer and Information Technology, Beijing Jiaotong University); Zilong Wang (School of Computer and Information Technology, Beijing Jiaotong University); Zhihong Xu (School of Computer and Information Technology, Beijing Jiaotong University); Yue Wang (School of Computer and Information Technology, Beijing Jiaotong University)",EasyDR: A Human-in-the-loop Error Detection&Repair Platform for Holistic Table Cleaning
Xuchen Pan (Beihang University); Yongxin Tong (Beihang University)*; Chunbo Xue (Beihang University); Zimu Zhou (Singapore Management University); Junping Du (Beijing University Of Posts And Telecommunications); Yuxiang Zeng (Hong Kong University of Science and Technology); Yexuan Shi (Beihang University); Xiaofei Zhang (University of Memphis); Lei  Chen (Hong Kong University of Science and Technology); Yi Xu (Beihang University); Ke Xu (Beihang University); Weifeng Lv (Beihang University),Hu-Fu: A Data Federation System for Secure Spatial Queries
Marius  Gassen (TU Darmstadt); Benjamin Hättasch (TU Darmstadt)*; Benjamin Hilprecht (TU Darmstadt); Nadja Geisler (TU Darmstadt); Alexander Fraser (LMU Munich); Carsten Binnig (TU Darmstadt),Demonstrating CAT: Synthesizing Data-Aware Conversational Agents for Transactional Databases
"Aurélien Personnaz (CNRs, Univ. Grenoble Alpes); Brit Youngmann (MIT)*; Sihem Amer-Yahia (CNRS)",EDA4SUM: Guided Exploration of Data Summaries
"Chenjie Li (Illinois Institute of Technology)*; Juseung Lee (Illinois Institute of Technology); Zhengjie Miao (Duke University); Boris Glavic (Illinois Institute of Technology); Sudeepa Roy (Duke University, USA)",CaJaDE: Explaining Query Results by Augmenting Provenance with Context
Yuki Asada (Microsoft); Victor Fu (Microsoft); Apurva Gandhi (Microsoft); Advitya Gemawat (Microsoft); Lihao Zhang (Microsoft); Vivek Gupta (Microsoft); Ehi Nosakhare (Microsoft); Dalitso Banda (Microsoft); Rathijit Sen (Microsoft); Matteo Interlandi (Microsoft)*,Share the Tensor Tea: How Databases can Leverage the Machine Learning Ecosystem
Jess Tan (NTU); Desmond Yeoh (NTU); Rachael Neoh (NTU); Huey Eng CHUA (Nanyang Technological University); Sourav S Bhowmick (Nanyang Technological University)*,MOCHA: A Tool for Visualizing Impact of Operator Choices in Query Execution Plans for Database Education
Tsz Nam Chan (Hong Kong Baptist University)*; Pak Lon Ip (University of Macau); kaiyan zhao (University of Macau); Leong Hou U (University of Macau); Byron Choi (Hong Kong Baptist University); Jianliang Xu (Hong Kong Baptist University),LIBKDV: A Versatile Kernel Density Visualization Library for Geospatial Analytics
Arul Ajmani (Cockroach Labs); Aayush Shah (Cockroach Labs); Alexander Shraer (Cockroach Labs); Adam Storm (Cockroach Labs); Rebecca Taft ()*; Oliver Tan (Cockroach Labs); Nathan VanBenschoten (Cockroach Labs),A Demonstration of Multi-Region CockroachDB
Adriane Chapman (University of Southampton); Luca Lauro (Roma Tre University); Paolo Missier (Newcastle University); Riccardo Torlone (Roma Tre University)*,DPDS: Assisting Data Science with Data Provenance
Vargha Dadvar (University of Waterloo); Lukasz Golab (University of Waterloo)*; Divesh Srivastava (AT&amp;T Chief Data Office),POEM: Pattern-Oriented Explanations of CNN Models
Ramon Antonio Rodriges Zalipynis (HSE University)*; Nikita A Terlych (HSE University),WebArrayDB: A Geospatial Array DBMS in Your Web Browser
Hai Lan (RMIT University)*; Yuanjia Zhang (PingCAP); Zhifeng  Bao (RMIT University); Dongxu Huang (PingCAP); Liu Tang (PingCAP); Yu Dong (PingCAP); Jian Zhang (PingCAP),AutoDI: Towards an Automatic Plan Regression Analysis
Susan B Davidson (University of Pennsylvania); Shay Gershtein (Tel Aviv University); Tova Milo (Tel Aviv University); Slava Novgorodov (Meta)*; May Shoshan (Tel Aviv University),PHOcus: Efficiently Archiving Photos
Kai Huang (HKUST)*; Qingqing  Ye (Hong Kong Polytechnic University); Jing ZHAO (HKUST); Xi Zhao (The Hong Kong University of Science and Technology); Haibo Hu (Hong Kong Polytechnic University); Xiaofang Zhou (Hong Kong University of Sci and Tech),VINCENT: Towards Efficient Exploratory Subgraph Search in Graph Databases
Osnat Drien (Bar Ilan University); Matanya Freiman (Bar Ilan University); Yael Amsterdamer (Bar-Ilan university )*,ActivePDB: Active Probabilistic Databases
Tommaso Teofili (Roma Tre University)*; Donatella Firmani (Sapienza University); Nick Koudas (University of Toronto); Paolo Merialdo (University Roma Tre); Divesh Srivastava (AT&amp;T Chief Data Office),CERTEM: Explaining and Debugging Black-box Entity Resolution Systems with CERTA
Ahmet Kerem Aksoy (TU Berlin); Pavel Dushev (SAP); Eleni Tzirita Zacharatou (IT University of Copenhagen)*; Holmer Hemsen (DFKI GmbH); Marcela Charfuelan (DFKI); Jorge Arnulfo Quiane Ruiz (TU Berlin); Begum Demir (TU Berlin); Volker Markl (Technische Universität Berlin),Satellite Image Search in AgoraEO
Li Yan (Nanyang Technological University); Nerissa Xu (Nanyang Technological University); Guozhong Li (Hong Kong Baptist University); Sourav S Bhowmick (Nanyang Technological University)*; Byron Choi (Hong Kong Baptist University); Jianliang Xu (Hong Kong Baptist University),SENSOR: Data-driven Construction of Sketch-based Visual Query Interfaces for Time Series Data
Angela Bonifati (Univ. of Lyon)*; Stefania G. Dumbrava (ENSIIE); Emile Martinez (ENS Lyon); Fatemeh Ghasemi (ENS Lyon); Malo Jaffré (ENS Lyon); Pacome Luton (ENS Lyon); Thomas Pickles (ENS Lyon),DiscoPG: Property Graph Schema Discovery and Exploration
wissam Mammar kouadri (University of Paris); Salima Benbernou (Université de paris)*; mourad ouziri (University of Paris); Themis Palpanas (University of Paris); Iheb Benamor (IMBA Consulting),"SA-Q: Observing, Evaluating, and Enhancing the Quality of the Results of Sentiment Analysis Tools"
Abdelghny Orogat (Carleton University)*; Ahmed El-Roby (Carleton University),SmartBench: Demonstrating Automatic Generation of Comprehensive Benchmarks for Question Answering Over Knowledge Graphs
"Jianhong Tu (Renmin University of China); Xiaoyue Han (Renmin University of China); Ju Fan (Renmin University of China)*; Nan Tang (Qatar Computing Research Institute, HBKU); Chengliang Chai (Tsinghua University); Guoliang Li (Tsinghua University); Xiaoyong Du (Renmin University of China)",DADER: Hands-Off Entity Resolution with Domain Adaptation
James L Gale (Sigma Computing)*; Max Seiden (Sigma Computing); Deepanshu Utkarsh (Sigma Computing); Jason Frantz (Sigma Computing); Rob Woollen (Sigma Computing); Cagatay Demiralp (Sigma Computing),Sigma Workbook: A Spreadsheet for Cloud Data Warehouses
Zihao Chen (East China Normal University); Zhizhen Xu (East China Normal University); Baokun Han (East China Normal University); Chen Xu (East China Normal University)*; Weining Qian (East China Normal University); Aoying Zhou (East China Normal University),ReMac: A Matrix Computation System with Redundancy Elimination
