author,title
"Phillip Wenig (Hasso Plattner Institute, University of Potsdam); Sebastian Schmidl (Hasso Plattner Institute, University of Potsdam)*; Thorsten Papenbrock (Philipps University of Marburg)",TimeEval: A Benchmarking Toolkit for Time Series Anomaly Detection Algorithms
"Alberto Lerner (University of Friborug)*; Matthias Jasny (TU Darmstadt); Theo Jepsen (USI); Carsten Binnig (TU Darmstadt); Philippe Cudre-Mauroux (University of Fribourg, Switzerland)",DBMS Annihilator: A High-Performance Database Workload Generator in Action
Zhiyu Liang (Harbin Institute of Technology); Hongzhi Wang (Harbin Institute of Technology)*,FedTSC: A Secure Federated Learning System for Interpretable Time Series Classification
Qingshun Wu (Zhengzhou Univeristy); Yafei Li (Zhengzhou University)*; huiling Li (Zhengzhou university); Di Zhang (Zhengzhou university); Guanglei Zhu (Zhengzhou University),AMRAS: A Visual Analysis System for Spatial Crowdsourcing
Hani Al-Sayeh (TU Ilmenau)*; Muhammad Attahir Jibril (TU Ilmenau); Muhammad Waleed Bin Saeed (TU Ilmenau); Kai-Uwe Sattler (TU Ilmenau),SparkCAD: Caching Anomalies Detector for Spark Applications
Wilco van Leeuwen (TU Eindhoven); Thomas Mulder (TU Eindhoven); Bram van de Wall (TU Eindhoven); George Fletcher (Eindhoven University of Technology); Nikolay Yakovets (TU Eindhoven)*,AvantGraph Query Processing Engine
Paul Boniol (Université de Paris)*; John Paparrizos (University of Chicago); Yuhao Kang (University of Chicago); Themis Palpanas (University of Paris); Ruey S. Tsay (University of Chicago); Aaron J Elmore (University of Chicago); Michael Franklin (University of Chicago),Theseus: Navigating the Labyrinth of Time-Series Anomaly Detection
Dennis M Hofmann (Worcester Polytechnic Institute); Peter VanNostrand (WPI); Huayi Zhang (WPI); Yizhou Yan (Worcester Polytechnic Institute); Lei Cao (MIT)*; Samuel Madden (MIT); Elke A Rundensteiner (WPI),A Demonstration of AutoOD: A Self-tuning Anomaly Detection System
Sunny Gakhar (Microsoft); Joyce Cahoon (Microsoft); Wangchao le (Microsoft); Xiangnan Li (Microsoft Corporation); Kaushik Ravichandran (Microsoft R&amp;D India); Hiren Patel (Microsoft); Marc Friedman (Microsoft); Brandon Haynes (Microsoft Gray Systems Lab); Shi Qiao (Keebo); Alekh  Jindal (Keebo); Jyoti Leeka (Microsoft)*,Pipemizer: An Optimizer for Analytics Data Pipelines
Sergey Redyuk (TU Berlin)*; Zoi Kaoudi (TU Berlin); Sebastian Schelter (University of Amsterdam); Volker Markl (Technische Universität Berlin),DORIAN in action: Assisted Design of Data Science Pipelines
Yuntian He (Ohio State University)*; Yue Zhang (The Ohio State University); Saket Gurukar (The Ohio State University); Srinivasan Parthasarathy (Ohio State University),WebMILE:  Democratizing Network Representation Learning at Scale
Nadja Geisler (TU Darmstadt)*; Benjamin Hättasch (TU Darmstadt); Carsten Binnig (TU Darmstadt),Demonstrating Quest: A Query-Driven Framework to Explain Classification Models on Tabular Data
Drew Ripberger (The Ohio State University)*; Yifan Gan (The Ohio State University); Xueyuan Ren (The Ohio State University); Yang Wang (The Ohio State University); Spyros Blanas (The Ohio State University),IsoBugView: Interactively Debugging Isolation Bugs in Database Applications
Yannis E Foufoulas (University of Athens)*; Alkis Simitsis (Athena Research Center); Yannis Ioannidis (University of Athens),YeSQL: Rich User-Defined Functions without the Overhead
Zhihui Yang (Zhejiang Lab)*; Yicong Huang (UC Irvine); Zuozhi Wang (U C IRVINE); Feng Gao (Zhejiang Lab); Yao Lu (Microsoft Research); Chen Li (UC Irvine); X. Sean Wang (Fudan University),Demonstration of Accelerating Machine Learning Inference Queries with Correlative Proxy Models
"Xiaozhen Liu (University of California, Irvine)*; Zuozhi Wang (U C IRVINE); Shengquan Ni (U C Irvine); Sadeem Alsudais (UCI); Yicong Huang (University of California, Irvine); Avinash Kumar (U C IRVINE); Chen Li (UC Irvine)",Demonstration of Collaborative and Interactive Workflow-Based Data Analytics in Texera
Ramon Antonio Rodriges Zalipynis (HSE University)*,SimDB in Action: Road Trafic Simulations Completely Inside Array DBMS
Gilbert Badaro (EURECOM)*; Paolo Papotti (Eurecom),Transformers for Tabular Data Representation: A Tutorial on Models and Applications
Felix Kiehn (Universität Hamburg); Mareike Schmidt (Universität Hamburg); Daniel Glake (Universität Hamburg); Fabian Panse (Universität Hamburg)*; Wolfram Wingerath (University of Oldenburg); Benjamin Wollmer (University of Hamburg); Martin Poppinga (Universität Hamburg); Norbert Ritter (Universität Hamburg),Polyglot Data Management: State of the Art & Open Challenges
Wasay Abdul (Intel Labs)*; Nesime Tatbul (Intel Labs and MIT); Justing Gottschlich (Merly AI),Machine Programming: Turning Data into Programmer Productivity
Guoliang Li (Tsinghua University)*; Haowen Dong (Tsinghua University); Chao Zhang (Tsinghua University),"Cloud Databases: New Techniques, Challenges, and Opportunities"
Amine Mhedhbi (University of Waterloo)*; Semih Salihoglu (University of Waterloo),"Modern Techniques for Querying Graph-Structured Relations: Foundations, System Implementations, and Open Challenges"
"Yixiang Fang (School of Data Science, The Chinese University of Hong Kong, Shenzhen); Wensheng Luo (School of Data Science, The Chinese University of Hong Kong, Shenzhen)*; Chenhao Ma (The University of Hong Kong)","Densest Subgraph Discovery on Large Graphs: Applications, Challenges, and Techniques"
Immanuel Trummer (Cornell)*,From BERT to GPT-3 Codex: Harnessing the Potential of Very Large Language Models for Data Management
Kaisong Huang (Simon Fraser University); Yuliang He (Simon Fraser University); Tianzheng Wang (Simon Fraser University)*,"The Past, Present and Future of Indexing on Persistent Memory"
Zoi Kaoudi (TU Berlin)*; Jorge Arnulfo Quiane Ruiz (TU Berlin),Unified Data Analytics: State-of-the-art and Open Problems
"Wenfei Fan (Shenzhen Institute of Computing Sciences, University of Edinburgh, Beihang University)*",Big Graphs: Challenges and Opportunities
Sihem Amer-Yahia (Univ. Grenoble Alpes)*,Towards AI-Powered Data-Driven Education
Yizhou Sun (UCLA)*; Jiawei Han (UIUC); Xifeng Yan (UCSB); Philip S. Yu (UIC); Tianyi Wu (Meta),"Heterogeneous Information Networks: the Past, the Present, and the Future"
Sudeepa Roy (Duke University)*,Toward Interpretable and Actionable Data Analysis with Explanations and Causality
Fatma Özcan (Google LLC)*,Reflections On My Data Management Research Journey (VLDB Women in Database Research Award Talk)
C. Mohan (Tsinghua University)*,Panel: Startups Founded by Database Researchers
"Magdalena Balazinska (University of Washington, Seattle);  Surajit Chaudhuri (Microsoft)*; AnHai Doan (University of Wisconsin, Madison); Joseph M. Hellerstein (University of California, Berkeley); Hanuma Kodavalla (Microsoft); Ippokratis Pandis (Amazon Web Services); Matei Zaharia (Stanford University)",Cloud Data Systems: What are the Opportunities for the Database Research Community?
"Sachin Basil John, Christoph Koch",High-dimensional Data Cubes
"Matteo Ceccarello, Johann Gamper",Fast and Scalable Mining of Time Series Motifs with Probabilistic Guarantees
"Daniel Deutch, Amir Gilad, Tova Milo, Amit Mualem, Amit Somech",FEDEX: An Explainability Framework for Data Exploration Steps
"Maria N Xekalaki, Juan Fumero, Athanasios Stratikopoulos, Katerina Doka, Christos Katsakioris, Constantinos Bitsakos, Nectarios Koziris, Christos Kotselidis",Enabling Transparent Acceleration of Big Data Frameworks using Heterogeneous Hardware
"Adriano Fazzone, Tommaso Lanciano, Riccardo Denni, Charalampos Tsourakakis, Francesco Bonchi",Discovering Polarization Niches via Dense Subgraphs with Attractors and Repulsers
"Eunjae Lee, Sam H. Noh, Jiwon Seo",Sage: A System for Uncertain Network Analysis
"Hongchao Qin, Rong-hua Li, Ye Yuan, Guoren Wang, Lu Qin, Zhiwei Zhang",Mining Bursting Core in Large Temporal Graph
"Xiang Yu, Chengliang Chai, Guoliang Li, Jiabin Liu",Cost-based or Learning-based? A Hybrid Query Optimizer for Query Plan Selection
"Jingfan Meng, Huayi Wang, Jun Xu, Mitsunori Ogihara",ONe Index for All  Kernels (ONIAK): A Zero Re-Indexing  LSH Solution to ANNS-ALT
"Jiachen Shi, Gao Cong, Xiaoli Li",Learned Index Benefits: Machine Learning Based Index Performance Estimation
"Jiachuan Wang, Peng Cheng, Libin Zheng, Lei  Chen, Wenjie Zhang",Online Ridesharing with Meeting Points
"Luigi Bellomarini, Davide Benedetto, Matteo Brandetti, Emanuel Sallinger",Exploiting the Power of Equality-generating Dependencies in Ontological Reasoning
"Anders Aamand, Debarati Das, Evangelos Kipouridis, Jakob B.t. Knudsen, Peter M.r. Rasmussen, Mikkel Thorup",No Repetition: Fast and Reliable Sampling with Highly Concentrated Hashing
"Lyes Attouche, Mohamed-amine Baazizi, Dario Colazzo, Giorgio Ghelli, Carlo Sartiani, Stefanie Scherzinger",Witness Generation for JSON Schema
"Shreya Shankar, Aditya Parameswaran",Towards Observability for Production Machine Learning Pipelines [Vision]
"Sekwon Lee, Soujanya Ponnapalli, Sharad Singhal, Marcos Aguilera, Kimberly Keeton, Vijay Chidambaram","DINOMO: An Elastic, Scalable, High-Performance Key-Value Store for Disaggregated Persistent Memory"
"Shreya Shankar, Stephen Macke, Sarah Chasins, Andrew Head, Aditya Parameswaran","Bolt-on, Compact, and Rapid Program Slicing for Notebooks [Scalable Data Science]"
"Weijie Sun, Zihuan Xu, Lei Chen",Fairness Matters: A Tit-For-Tat Strategy Against Selfish Mining
"Jialin Ding, Ryan C Marcus, Andreas Kipf, Vikram Nathan, Aniruddha Nrusimha, Kapil Vaidya, Alexander Van Renen, Tim Kraska",SageDB: An Instance-Optimized Data Analytics System
"Keven Richly, Rainer Schlosser, Martin Boissier",Budget-Conscious Fine-Grained Configuration Optimization for Spatio-Temporal Applications
"Cheng-yu Hsieh, Jieyu Zhang, Alexander J Ratner",Nemo: Guiding and Contextualizing Weak Supervision for Interactive Data Programming
